chapter_num,status_simple,v2_lc,v2_idx,v2_text,v1_lc,v1_idx,v1_text,dist
07,edited,9,41,Why is it important to construct a histogram of sample means or proportions in a simulation study? - A. To visualize the distribution and assess normality or other patterns - B. To increase the accuracy of the sample means - C. To ensure all sample means are exactly the same - D. To remove any outliers from the data,12,56,Why is it important that sampling be done *at random*?,0.7083894903662489
07,edited,10,46,"In the case of our bowl activity, what is the *population parameter*? Do we know its value? How can we know its value exactly?",8,36,"In the case of our bowl activity, what is the *population parameter*? Do we know its value?",0.13016568648811128
07,edited,11,51,How did we ensure that the samples collected with the shovel were random?,11,51,How did we ensure that our tactile samples using the shovel were random?,0.2483277571213064
07,edited,12,56,What is the expected value of the sample mean in the context of sampling distributions? - A. The observed value of the sample mean - B. The population mean - C. The median of the sample distribution - D. The midpoint of the range,14,66,What purpose did the *sampling distributions* serve?,0.5262939881886867
07,edited,13,61,"What is the role of the Central Limit Theorem (CLT) in statistical inference? - A. It provides the formula for calculating the standard deviation of any given sample, allowing for an understanding of the sample's spread or variability. - B. It states that the sampling distribution of the sample mean will approach a normal distribution, regardless of the population's distribution, as the sample size becomes large. - C. It determines the actual mean of the population directly by calculating it from a randomly selected sample, without needing additional data or assumptions. - D. It is a principle that applies strictly and exclusively to populations that are normally distributed, ensuring that only in such cases the sample means will follow a normal distribution pattern.",16,76,"The table that follows is a version of Table \@ref(tab:comparing-n-2) matching sample sizes $n$ to different *standard errors* of the sample proportion $\widehat{p}$, but with the rows randomly re-ordered and the sample sizes removed. Fill in the table by matching the correct sample sizes to the correct standard errors. set.seed(76) comparing_n_table <- virtual_prop %>% group_by(n) %>% summarize(sd = sd(prop_red)) %>% mutate( n = str_c(""n = "") ) %>% rename(`Sample size` = n, `Standard error of $\\widehat{p}$` = sd) %>% sample_frac(1) comparing_n_table %>% kbl( digits = 3, caption = ""Standard errors of $\\widehat{p}$ based on n = 25, 50, 100"", booktabs = TRUE, escape = FALSE, linesep = """" ) %>% kable_styling( font_size = ifelse(is_latex_output(), 10, 16), latex_options = c(""hold_position"") ) For the following four *Learning checks*, let the *estimate* be the sample proportion $\widehat{p}$: the proportion of a shovel's balls that were red. It estimates the population proportion $p$: the proportion of the bowl's balls that were red.",0.5556874465792256
07,edited,14,66,"What does the term ""sampling variation"" refer to? - A. Variability in the population data. - B. Differences in sample statistics due to random sampling. - C. Changes in the population parameter over time. - D. Variation caused by errors in data collection.",7,31,What summary statistic did we use to quantify how much the 1000 proportions red varied? - A. The interquartile range - B. The standard deviation - C. The range: the largest value minus the smallest.,0.6968300422487741
07,edited,15,71,How does increasing the sample size affect the standard error of the sample mean? - A. It increases the standard error - B. It decreases the standard error - C. It has no effect on the standard error - D. It only affects the standard deviation,15,71,What does the *standard error* of the sample proportion $\widehat{p}$ quantify?,0.5337181616824008
07,edited,16,76,"For each of the following cases, explain whether the sampling distribution of the sample mean approximates a normal distribution. - When the population distribution is normal. - When the sample size is very large. - When the sample size is sufficiently large, regardless of the population distribution. - When the population distribution is uniform.",19,91,"In a real-life situation, we would not take 1000 different samples to infer about a population, but rather only one. Then, what was the purpose of our exercises where we took 1000 different samples?",0.6322895638558177
07,edited,17,81,"In the context of comparing two samples, why do we add variances (squared standard deviations) instead of subtracting them when finding the standard error of the difference? - A. Because variances always cancel each other out - B. Because adding variances reflects the total uncertainty from both samples - C. Because subtracting variances always gives negative results - D. Because variances are not related to the standard error",23,111,"You want to know the prevalence of illegal downloading of TV shows among students at a local college. You get the emails of 100 randomly chosen students and ask them, ""How many times did you download a pirated TV show last week?"".",0.8613260508253168
07,edited,18,86,"What is the sampling distribution of the difference in sample proportions expected to look like if both samples are large enough? - A. Uniform. - B. Bell-shaped, approximating a normal distribution. - C. Bimodal. - D. Skewed to the right.",20,96,"Figure \@ref(fig:accuracy-vs-precision) with the targets shows four combinations of ""accurate versus precise"" estimates. Draw four corresponding *sampling distributions* of the sample proportion $\widehat{p}$, like the one in the leftmost plot in Figure \@ref(fig:comparing-sampling-distributions-3).",0.5358610549558046
07,removed,NA,NA,NA,10,46,What purpose do *point estimates* serve in general? What is the name of the point estimate specific to our bowl activity? What is its mathematical notation?,NA
07,removed,NA,NA,NA,17,81,What is the difference between an *accurate* and a *precise* estimate?,NA
07,removed,NA,NA,NA,18,86,How do we ensure that an estimate is *accurate*? How do we ensure that an estimate is *precise*?,NA
07,removed,NA,NA,NA,21,101,The Royal Air Force wants to study how resistant all their airplanes are to bullets. They study the bullet holes on all the airplanes on the tarmac after an air battle against the Luftwaffe (German Air Force).,NA
07,removed,NA,NA,NA,22,106,"Imagine it is 1993, a time when almost all households had landlines. You want to know the average number of people in each household in your city. You randomly pick out 500 phone numbers from the phone book and conduct a phone survey.",NA
07,removed,NA,NA,NA,24,116,"A local college administrator wants to know the average income of all graduates in the last 10 years. So they get the records of five randomly chosen graduates, contact them, and obtain their answers.",NA
08,new,1,1,What is the expected value of the sample mean weight of almonds in a large sample according to the sampling distribution theory? - A. It is always larger than the population mean. - B. It is always smaller than the population mean. - C. It is exactly equal to the population mean. - D. It is equal to the population mean on average but may vary in any single sample.,NA,NA,NA,0.9
08,new,2,6,What is a **point estimate** and how does it differ from an **interval estimate** in the context of statistical estimation? - A. A point estimate uses multiple values to estimate a parameter; an interval estimate uses a single value. - B. A point estimate is a single value used to estimate a parameter; an interval estimate provides a range of values within which the parameter likely falls. - C. A point estimate is the mean of multiple samples; an interval estimate is the median. - D. A point estimate and an interval estimate are the same and can be used interchangeably.,NA,NA,NA,0.9
08,new,3,11,"What does the population mean ($\mu$) represent in the context of the almond activity? - A. The average weight of 100 randomly sampled almonds. - B. The weight of the heaviest almond in the bowl. - C. The average weight of all 5,000 almonds in the bowl. - D. The total weight of all almonds in the bowl.",NA,NA,NA,0.9
08,new,4,16,Which of the following statements best describes the population standard deviation ($\sigma$) in the almond activity? - A. It measures the average difference between each almond's weight and the sample mean weight. - B. It measures the average difference between each almond's weight and the population mean weight. - C. It is equal to the square root of the sample variance. - D. It is always smaller than the population mean.,NA,NA,NA,0.9
08,new,5,21,Why do we use the sample mean to estimate the population mean in the almond activity? - A. Because the sample mean is always larger than the population mean. - B. Because the sample mean is a good estimator of the population mean due to its unbiasedness. - C. Because the sample mean requires less computational effort than the population mean. - D. Because the sample mean eliminates all sampling variation.,NA,NA,NA,0.9
08,new,6,26,How is the standard error of the sample mean weight of almonds calculated in the context of this example? - A. By dividing the sample mean by the population standard deviation. - B. By dividing the population standard deviation by the square root of the sample size. - C. By multiplying the sample mean by the square root of the sample size. - D. By dividing the population mean by the sample size.,NA,NA,NA,0.9
08,new,7,31,What does a 95% confidence interval represent in the context of the almond weight estimation? - A. There is a 95% chance that the sample mean is within 1.96 standard deviations from the population mean. - B. The interval will contain 95% of the almond weights from the sample. - C. There is a 95% chance that the population mean falls within 1.96 standard errors from the sample mean. - D. The sample mean is exactly equal to the population mean 95% of the time.,NA,NA,NA,0.9
08,new,8,36,Why does the $t$ distribution have thicker tails compared to the standard normal distribution? - A. Because the sample mean is considered more likely to match the population mean closely. - B. Because the $t$ distribution is designed to work when the data does not follow a normal distribution. - C. Because it assumes that the sample size is always smaller when applying the $t$ distribution. - D. Because it accounts for the extra uncertainty that comes from using the sample standard deviation instead of the population standard deviation. \newpage,NA,NA,NA,0.9
08,new,9,41,What is the effect of increasing the degrees of freedom on the $t$ distribution? - A. The tails of the distribution become thicker. - B. The tails of the distribution become thinner. - C. The distribution does not change with degrees of freedom. - D. The distribution becomes skewed to the right.,NA,NA,NA,0.9
08,edited,10,46,What is the chief difference between a bootstrap distribution and a sampling distribution?,1,1,What is the chief difference between a bootstrap distribution and a sampling distribution?,0.04
08,edited,11,51,"Looking at the bootstrap distribution for the sample mean in Figure \@ref(fig:one-thousand-sample-means), between what two values would you say *most* values lie?",2,6,"Looking at the bootstrap distribution for the sample mean in Figure \@ref(fig:one-thousand-sample-means), between what two values would you say *most* values lie?",0.04
08,edited,12,56,"Which of the following is true about the confidence level when constructing a confidence interval? - A. The confidence level determines the width of the interval and affects how likely it is to contain the population parameter. - B. The confidence level is always fixed at 95% for all statistical analyses involving confidence intervals. - C. A higher confidence level always results in a narrower confidence interval, making it more useful for practical purposes. - D. The confidence level is only relevant when the population standard deviation is known.",4,16,Say we wanted to construct a 68% confidence interval instead of a 95% confidence interval for $\mu$. Describe what changes are needed to make this happen. Hint: we suggest you look at Appendix \@ref(appendix-normal-curve) on the normal distribution.,0.5692973940140779
08,new,13,61,"How does increasing the sample size affect the width of a confidence interval for a given confidence level? - A. It increases the width of the confidence interval, making it less precise. - B. It has no effect on the width of the confidence interval since the confidence level is fixed. - C. It decreases the width of the confidence interval, making it more precise by reducing the margin of error. - D. It changes the confidence level directly, regardless of other factors.",NA,NA,NA,0.9
08,edited,14,66,Construct a 95% confidence interval for the *median* weight of *all* almonds with the percentile method. Is it appropriate to also use the standard-error method?,5,21,"Construct a 95% confidence interval for the *median* year of minting of *all* US pennies. Use the percentile method and, if appropriate, then use the standard-error method.",0.2634818790544146
08,new,15,71,What are the advantages of using `infer` for building confidence intervals?,NA,NA,NA,0.9
08,new,16,76,What is the main purpose of bootstrapping in statistical inference? - A. To visualize data distributions and identify outliers. - B. To generate multiple samples from the original data for estimating parameters. - C. To replace missing data points with the mean of the dataset. - D. To validate the assumptions of a regression model.,NA,NA,NA,0.9
08,new,17,81,"""Which function denotes the variables of interest for inference?"" - A. `rep_sample_n()` - B. `calculate()` - C. `specify()` - D. `visualize()`",NA,NA,NA,0.9
08,edited,18,86,"What is a key difference between the percentile method and the standard error method for constructing confidence intervals using bootstrap samples? - A. The percentile method requires the population standard deviation. - B. The percentile method uses the middle 95% of bootstrap statistics, while the standard error method relies on the estimated standard error. - C. The standard error method always results in a narrower confidence interval. - D. The percentile method requires more bootstrap samples.",3,11,What condition about the bootstrap distribution must be met for us to be able to construct confidence intervals using the standard error method?,0.5160891994632114
09,edited,1,1,"Why does the following code produce an error? In other words, what about the response and predictor variables make this not a possible computation with the `infer` package? library(moderndive) library(infer) null_distribution_mean <- spotify_metal_deephouse |> specify(formula = popular_or_not ~ track_genre, success = ""popular"") |> hypothesize(null = ""independence"") |> generate(reps = 1000, type = ""permute"") |> calculate(stat = ""diff in means"", order = c(""metal"", ""deep-house""))",1,1,"Why does the following code produce an error? In other words, what about the response and predictor variables make this not a possible computation with the `infer` package? library(moderndive) library(infer) null_distribution_mean <- promotions %>% specify(formula = decision ~ gender, success = ""promoted"") %>% hypothesize(null = ""independence"") %>% generate(reps = 1000, type = ""permute"") %>% calculate(stat = ""diff in means"", order = c(""male"", ""female""))",0.17669314538241032
09,edited,2,6,Why are we relatively confident that the distributions of the sample proportions will be good approximations of the population distributions of popularity proportions for the two genres?,2,6,Why are we relatively confident that the distributions of the sample proportions will be good approximations of the population distributions of promotion proportions for the two genders?,0.043225334580659025
09,edited,3,11,"Using the definition of _p-value_, write in words what the $p$-value represents for the hypothesis test comparing the popularity rates for metal and deep house.",3,11,"Using the definition of _p-value_, write in words what the $p$-value represents for the hypothesis test comparing the promotion rates for males and females.",0.18485502127760345
09,edited,4,16,Describe in a paragraph how we used Allen Downey's diagram to conclude if a statistical difference existed between the popularity rate of metal and deep house for the Spotify example.,4,16,Describe in a paragraph how we used Allen Downey's diagram to conclude if a statistical difference existed between the promotion rate of males and females using this study.,0.24105828707121812
09,unchanged,5,21,"What is wrong about saying, ""The defendant is innocent."" based on the US system of criminal trials?",5,21,"What is wrong about saying, ""The defendant is innocent."" based on the US system of criminal trials?",0
09,unchanged,6,26,What is the purpose of hypothesis testing?,6,26,What is the purpose of hypothesis testing?,0
09,unchanged,7,31,What are some flaws with hypothesis testing? How could we alleviate them?,7,31,What are some flaws with hypothesis testing? How could we alleviate them?,0
09,edited,8,36,"Consider two $\alpha$ significance levels of 0.1 and 0.01. Of the two, which would lead to a higher chance of committing a Type I Error?",8,36,"Consider two $\alpha$ significance levels of 0.1 and 0.01. Of the two, which would lead to a more *liberal* hypothesis testing procedure? In other words, one that will, all things being equal, lead to more rejections of the null hypothesis $H_0$.",0.33849907009998215
09,unchanged,9,41,Conduct the same analysis comparing action movies versus romantic movies using the median rating instead of the mean rating. What was different and what was the same?,9,41,Conduct the same analysis comparing action movies versus romantic movies using the median rating instead of the mean rating. What was different and what was the same?,0
09,edited,10,46,What conclusions can you make from viewing the faceted histogram looking at `rating` versus `genre` that you could not see when looking at the boxplot?,10,46,What conclusions can you make from viewing the faceted histogram looking at `rating` versus `genre` that you couldn't see when looking at the boxplot?,0.028566533454703502
09,unchanged,11,51,Describe in a paragraph how we used Allen Downey's diagram to conclude if a statistical difference existed between mean movie ratings for action and romance movies.,11,51,Describe in a paragraph how we used Allen Downey's diagram to conclude if a statistical difference existed between mean movie ratings for action and romance movies.,0
09,unchanged,12,56,Why are we relatively confident that the distributions of the sample ratings will be good approximations of the population distributions of ratings for the two genres?,12,56,Why are we relatively confident that the distributions of the sample ratings will be good approximations of the population distributions of ratings for the two genres?,0
09,unchanged,13,61,"Using the definition of $p$-value, write in words what the $p$-value represents for the hypothesis test comparing the mean rating of romance to action movies.",13,61,"Using the definition of $p$-value, write in words what the $p$-value represents for the hypothesis test comparing the mean rating of romance to action movies.",0
09,edited,14,66,What is the value of the $p$-value for the two-sided hypothesis test comparing the mean rating of romance to action movies?,14,66,What is the value of the $p$-value for the hypothesis test comparing the mean rating of romance to action movies?,0.057690700626636615
09,unchanged,15,71,Test your data-wrangling knowledge and EDA skills: - Use `dplyr` and `tidyr` to create the necessary data frame focused on only action and romance movies (but not both) from the `movies` data frame in the `ggplot2movies` package. - Make a boxplot and a faceted histogram of this population data comparing ratings of action and romance movies from IMDb. - Discuss how these plots compare to the similar plots produced for the `movies_sample` data.,15,71,Test your data wrangling knowledge and EDA skills: - Use `dplyr` and `tidyr` to create the necessary data frame focused on only action and romance movies (but not both) from the `movies` data frame in the `ggplot2movies` package. - Make a boxplot and a faceted histogram of this population data comparing ratings of action and romance movies from IMDb. - Discuss how these plots compare to the similar plots produced for the `movies_sample` data.,0
10,new,1,1,What does the error term $\epsilon$ in the linear model $Y = \beta_0 + \beta_1 \cdot X + \epsilon$ represent? - A. The exact value of the response variable. - B. The predicted value of the response variable based on the model. - C. The part of the response variable not explained by the line. - D. The slope of the linear relationship between $X$ and $Y$.,NA,NA,NA,0.9
10,new,2,6,"Which of the following is a property of the least squares estimators $b_0$ and $b_1$? - A. They are biased estimators of the population parameters $\beta_0$ and $\beta_1$. - B. They are linear combinations of the observed responses $y_1, y_2, \ldots, y_n$. - C. They are always equal to the population parameters $\beta_0$ and $\beta_1$. - D. They depend on the specific values of the explanatory variable $X$ only.",NA,NA,NA,0.9
10,new,3,11,How can the difference in means between two groups be represented in a linear regression model? - A. By adding an interaction term between the groups and the response variable. - B. By fitting separate regression lines for each group and comparing their slopes. - C. By including a dummy variable to represent the groups. - D. By subtracting the mean of one group from the mean of the other and using this difference as the predictor.,NA,NA,NA,0.9
10,new,4,16,"In the context of a linear regression model, what does the null hypothesis $H_0: \beta_1 = 0$ represent? - A. There is no linear association between the response and the explanatory variable. - B. The difference between the observed and predicted values is zero. - C. The linear association between response and explanatory variable crosses the origin. - D. The probability of committing a Type II Error is zero. <!-- question above was repeated. I changed it -->",NA,NA,NA,0.9
10,new,5,21,Which of the following is an assumption of the linear regression model? - A. The error terms $\epsilon_i$ are normally distributed with constant variance. - B. The error terms $\epsilon_i$ have a non-zero mean. - C. The error terms $\epsilon_i$ are dependent on each other. - D. The explanatory variable must be normally distributed.,NA,NA,NA,0.9
10,new,6,26,What does it mean when we say that the slope estimator $b_1$ is a random variable? - A. $b_1$ will be the same for every sample taken from the population. - B. $b_1$ is a fixed value that does not change with different samples. - C. $b_1$ can vary from sample to sample due to sampling variation. - D. $b_1$ is always equal to the population slope $\beta_1$.,NA,NA,NA,0.9
10,edited,7,31,"Use the the `un_member_states_2024` data frame included in the `moderndive` package with response variable fertility rate (`fert_rate`) and the regressor life expectancy (`life_exp`). - Use the `get_regression_points()` function to get the observed values, fitted values, and residuals for all UN member countries. - Perform a residual analysis and look for any systematic patterns in the residuals. Ideally, there should be little to no pattern but comment on what you find here.",1,1,"Continuing with our regression using `age` as the explanatory variable and teaching `score` as the outcome variable. - Use the `get_regression_points()` function to get the observed values, fitted values, and residuals for all `r n_evals_ch5` instructors. - Perform a residual analysis and look for any systematic patterns in the residuals. Ideally, there should be little to no pattern but comment on what you find here.",0.22931432106910205
10,new,8,36,"In the context of linear regression, a `p_value` of near zero for the slope coefficient suggests which of the following? - A. The intercept is statistically significant at a 95% confidence level. - B. There is strong evidence against the null hypothesis that the slope coefficient is zero, suggesting there exists a linear relationship between the explanatory and response variables. - C. The variance of the response variable is significantly greater than the variance of the explanatory variable. - D. The residuals are normally distributed with mean zero and constant variance.",NA,NA,NA,0.9
10,new,9,41,Explain whether or not the residual plot helps assess each one of the following assumptions. - Linearity of the relationship between variables - Independence of the error terms - Normality of the error terms - Equality or constancy of variance,NA,NA,NA,0.9
10,new,10,46,"If the residual plot against fitted values shows a ""U-shaped"" pattern, what does this suggest? - A. The variance of the residuals is constant. - B. The linearity assumption is violated. - C. The independence assumption is violated. - D. The normality assumption is satisfied.",NA,NA,NA,0.9
10,edited,11,51,"Repeat the inference but this time for the correlation coefficient instead of the slope. Note the implementation of `stat = ""correlation""` in the `calculate()` function of the `infer` package.",2,6,"Repeat the inference but this time for the correlation coefficient instead of the slope. Note the implementation of `stat = ""correlation""` in the `calculate()` function of the `infer` package.",0.027692307692307693
